document,topic,gamma,text
133,6,0.997211676, I'd renegotiate. We make up 25 percent of the world's economy. In order  either China is going to write the rules of the road for the 21st century on trade or we are. We have to join with the 40 percent of the world that we had with us and this time make sure that there's no one sitting at that table doing the deal unless environmentalists are there and labor is there.
134,6,0.995436198,And to make sure we equip our workers first to compete by investing in them now in the things that make them more competitive. That's what we have to do. Otherwise they are going to write the rules of the road. We must have the rest of the world join us to keep them in check from abusing.
144,6,0.995772669,I support making sure that every single solitary person needing childcare get an $8000 tax credit now. That would put 700000 women back to work increase the GDP by almost 8/10 of 1 percent. It's the right thing to do if we can give tax breaks to corporations for these things why can't we do it this way?
152,6,0.995772669,I support a woman's right to choose. I support it's a constitutional right. I've supported it and I will continue to support it and I will in fact move as president to see to it that the Congress legislates that that is the laws as well.
164,6,0.993304504,Democratic presidential candidates debate in Houston. (Win Mcnamee/Getty Images)
165,6,0.997211676, That will be for the voters to decide that question. Let me tell you what I think. I think we should have a debate on health care. I think ' I know that the senator says she's for Bernie well I'm for Barack. I think the Obamacare worked. I think the way we add to it replace everything that has been cut add a public option guarantee that everyone will be able to have affordable insurance
175,6,0.977634638, One hundred fortynine million.
182,6,0.898283932, You just described my plan.
183,6,0.963331876, They do not have to buy in. They do not have to buy in.
233,6,0.994004598, Yeah well look we're either going to make policy or China's going to make the rules of the road. We make up 25 percent of the world economy. We need another 25 percent to join us.
243,6,0.995436198,I said ' from that point on ' what I was argued against in the beginning once he started to put the troops in was that in fact we were doing it the wrong way; there was no plan; we should not be engaged; we didn't have the people with us; we didn't have our ' we didn't have allies with us et cetera.
250,6,0.997665732,It's not want they don't want to help. They don't ' they don't know quite what to do. Play the radio make sure the television ' excuse me make sure you have the record player on at night the ' the ' make sure that kids hear words. A kid coming from a very poor school ' a very poor background will hear 4 million words fewer spoken by the time they get there.
251,6,0.963331876, There's so much we ' no I'm going to go like the rest of them do twice over okay?
266,6,0.997665732,On the ' look the fact that George Washington worried on the first time he spoke after being elected president that what we had to worry about is foreign interference in our elections it was the greatest threat to America. This president on three occasions ' three occasions ' has invited foreign governments and heads of government to get engaged in trying to alter our elections. The fact is that it is outrageous.
275,6,0.99691127, No look demonizing wealth  what I talked about is how you get things done. And the way to get things done is take a look at the tax code right now. The idea  we have to start rewarding work not just wealth. I would eliminate the capital gains tax  I would raise the capital gains tax to the highest rate of 39.5 percent.
313,6,0.983910504, We can do that without Medicare for all. We can do that by adding a public option.
330,6,0.996735411,And by the way I learned something about these impeachment trials. I learned number one that Donald Trump doesn't want me to be the nominee. That's pretty clear. He held up aid to make sure that  while at the same time innocent people in the Donbas are getting killed by Russian soldiers.
333,6,0.797299164, You know we can do this without charging people  raising $30 trillion $40 trillion. The fact is that right now the vast majority of Democrats do not support Medicare for all.
335,6,0.997665732,We should build on Obamacare provide the plan I put forward before anybody in here adding a Medicare option in that plan and not make people choose. Allow people to choose I should say. If you go the route of my two friends on my right and my left you have to give up your private insurance. A hundred and sixty million people like their private insurance. And if they don't like it
342,6,0.996315899,And I don't think it's a good idea that we mock  that we model ourselves after Trump and say lock him up. Look we have to bring this country together. Let's start talking civilly to people and treating  you know the next president starts tweeting should  anyway.
365,6,0.99241929,But one thing we haven't talked about here today we haven't talked  we talked about everything but we haven't talked about the one thing I think is most consequential.
381,6,0.995041532,Number two with Trump out of the way it's not going to change things in a fundamental way. But what it will do is it will mean that we're in a position where he's not going to be able to intimidate the base his base is not going to be able to intimidate those half a dozen Republicans we may need in other things.
382,6,0.996062934,I refuse to accept the notion as some on this stage do that we can never never get to a place where we have cooperation again. If that's the case we're dead as a country. We need to be able to reach a consensus. And if anyone has reason to be angry with the Republicans and not want to cooperate it's me the way they've attacked me
384,6,0.994004598, We attempted to close Guantanamo Bay but you have to have congressional authority to do it. They've kept it open. And the fact is that we in fact think it's greatest  it is an advertisement for creating terror.
392,6,0.995772669,And what we started in our administration that Trump stopped we should be moving 60 percent of our sea power to that area of the world to let in fact the Chinese understand that they're not going to go any further. We are going to be there to protect other folks.
423,6,0.996538319, I don't think it is realistic but let me explain why. I introduced a plan to build on Obamacare. Remind everybody 20 million people got insurance who didn't have it before. All people with preexisting conditions were able to be covered. I could go on. We didn't get all that we wanted.
432,6,0.99691127,The idea that you're going to be able to save that person making $60000 a year on Medicare for all is absolutely preposterous. Sixteen percent of the American public is on Medicare now and everybody has a tax taken out of their paycheck now. Tell me you're going to add 84 percent more and there's not going to be higher taxes? At least before he was honest about it.
14,7,0.995041532,Yes. You cannot let'as the mayor said you cannot let people who are sick no matter where they come from no matter what their status go uncovered. You can't do that. It's just going to be taking care of period. You have to. It's the humane thing to do.
26,7,0.996062934,when in fact my city was in flames because of the'the assassination of Dr. King number one. Now number two as the U.S.'as'excuse me'as the vice president of the United States I worked with a man who in fact we worked very hard to see to it we dealt with these issues in a major
34,7,0.898283932,Can I respond'
35,7,0.998291658,I have seen what happened just sense we were vice president. We needed three votes to pass an $800 billion recovery act that kept us from going into depression. I got three votes changed. We needed to be able to keep the government from shutting down and going bankrupt. I got Mitch McConnell to raise taxes $600 billion by raising the top rate. And as recently as after the President got elected I was able to put together a coalition on the Cures Act that billions of dollars go into cancer research bipartisan.
44,7,0.991264347,I don't'I don't buy that. The first'the first thing I would do is make sure that we defeat Donald Trump.
60,7,0.963331876,So Mr. President let's get something straight:
87,7,0.996735411,The fact is what the senator from New York talked about is seeking asylum. That woman the women she spoke to are entitled to asylum. That is not crossing the border illegally. What we should do is flood the zone to make sure we have people to make those decisions quickly.
90,7,0.996315899,In addition to that we're in a circumstance where if in fact you say you can just cross the border what do you say to all those people around the world who in fact want the same thing to come to the United States and make their case that they don't  that they have to wait in line. The fact of the matter is you should be able to  if you cross the border illegally you should be able to be sent back. It's a crime. It's a crime
92,7,0.997757044,I have guts enough to say his plan doesn't make sense. Here's the deal. The fact of the matter is that in fact when people cross the border illegally it is illegal to do it unless they're seeking asylum. People should have to get in line. That's the problem. And the only reason this particular part of the law is being abused is because of Donald Trump. We should defeat Donald Trump and end this practice.
96,7,0.99691127, The president came along and he's the guy that came up with the idea the first time ever dealing with the dreamers. He put that in the law. He had talked about a comprehensive plan which he put on the  laid before the Congress saying that we should find a pathway to citizenship for people. He said we should up the number of people that we're able to bring in to this country.
118,7,0.995041532,And the fact was that she in fact was told by her own people that her own staff that she should do something about and disclose to defense attorney's like me that you in fact have been  the police officer did something that did not give you information of what  your  your client. She didn't do that. She never did it. And so what happened.
122,7,0.963331876, I also invested $400 billion 
126,7,0.996315899, My plan calls for 500000 charging stations around the country so by 2030 we're all electric vehicles. My plan calls for making sure that we have $400 billion invested in technologies to learn how to contain what we're doing creating 10 million new jobs.
132,7,0.995041532,We invested significantly in this city when transportation only  anyway the point is we've made significant investment in this state. I expect in this city  I suspect that's why the mayor endorsed me.
138,7,0.977634638, No he said would I insist that labor be engaged?
146,7,0.995041532, The very beginning my deceased wife worked when we had children. My present wife has worked all the way through raising our children. The fact of the matter is the situation is one that I don't know what's happened.
189,7,0.996538319, Well first of all let me say that when I came back from law school I had a job with a great ' a bigtime law firm. I left and became a public defender because my state was under siege when Dr. King was assassinated. We were occupied by the National Guard for 10 months.
195,7,0.993304504, have access to be able to move along the way. I've laid out a detailed plan along those lines. And the fact is we've learned so much more more
223,7,0.983910504, I'm the vice president of the United States.
225,7,0.987436035, Secretary Castro would you want to respond to Vice President ?
234,7,0.997919791,And I think Elizabeth ' Senator Warren is correct. At the table has to be labor and at the table have to be environmentalists. The fact of the matter is China ' the problem isn't the trade deficit the problem is they're stealing our intellectual property. The problem is they're violating the WTO. They're dumping steel on us. That's a different issue than whether or not they're dumping agricultural products on us.
289,7,0.977634638, No no I'm not. No I'm not. I'm not.
304,7,0.99691127,I want to point out that the justices I've supported when I defeated Robert Bork  and I say when I defeated Robert Bork I made sure we guaranteed a woman's right to choose for the better part of a generation. I would make sure that we move and insist that we pass we codify Roe v. Wade.
328,7,0.994572145, Well look the next president of the United States is going to have to do two things. Defeat Donald Trump that's number one. And number two going to have to be able make be  be able to go into states like Georgia and North Carolina and other places and get a Senate majority. That's what I'll do.
338,7,0.996315899,I've done it. I've brought people together. I'm always told by everybody around here things have changed you can't do that anymore. If we can't  I thought the question was initially asked of the senator how do you unify this country? We have to unify this country. I have done it. I have done it repeatedly.
341,7,0.995041532,And so I would  whatever was determined by the attorney general I supported that I appointed let them make an independent judgment. If that was the judgment that he violated the law and he should be in fact criminally prosecuted then so be it. But I would not direct it.
344,7,0.963331876, Can I respond very quickly?
357,7,0.997069151,We do not spend nearly enough time dealing with  I was stunned when I did a virtual town meeting that told me 30000 people were on the call young people between 15 and 25 and found out I said what do you need  what do you need to make you safer on college campuses and on your schools? You know what they said? Get men involved engage the rest of the community.
361,7,0.996538319,Secondly I'm  you know I'm part of that Obama coalition. I come out of a black community in terms of my support. If you notice I have more people supporting me in the black community that have announced for me because they know me they know who I am. Three former chairs of the black caucus
363,7,0.994004598,So my point is  my point is that one of the reasons I was picked to be vice president was because of my relationship longstanding relationship with the black community. I was part of that coalition.
379,7,0.99756667,For example we shouldn't build another new highway in America that doesn't have charging stations on it. We have an opportunity to put 550000 charging stations so that we own the electrical vehicle market creating millions of jobs for people installing them as well as making sure that we own the electric vehicle market. There are so many things we can do and we have to make sure we explain it to those people who are displaced
389,7,0.994004598,  Senator Warren is correct. We have led by not the example of our power but the power of our example. And the example we're demonstrating now is horrible. It's hurting us badly.
404,7,0.963331876, I was joking. That was a joke.
439,7,0.995772669,Look we all have big progressive plans. And the question is who can deliver on those plans? And it seems to me we have to ask ourselves three questions straight up and honestly. Who has the best chance the most likely chance of defeating Donald Trump? Who is the one who's most likely to do that?
18,8,0.998239197,The first thing I would do is unite families. I would surge immediately billions of dollars' worth of help to the region the immediately. Look I talk about foreign policy. I am the guy that got a bipartisan agreement at the very end of the campaign at the very end of our term to spend $740 million to deal with the problem and that was to go to the root cause of why people are leaving in the first place. It was working. We saw as you know a net decrease in the number of children who were coming. The crisis was updated and along came this President and he said he immediately discontinued that. We all talk about these things I did it. I did it.
23,8,0.685397626,That person should not be the focus of deportation. We should fundamentally change the way we deal with things.
33,8,0.983910504,The first constitutional amendment to do that was introduced by me when I was a young senator.
41,8,0.983910504,The first constitutional amendment to do that was introduced by me when I was a young senator.
49,8,0.989694234,We know NATO will fall apart if he is elected for more years it is the single most consequential alliance'
50,8,0.997069151,Because once we'once Bush abuse that power what happened was we got elected after that. I made sure the president turned to me and said Joe get our combat troops out of Iraq. I was responsible for getting 150000 combat troops out of Iraq and my son was one of them. I also think we should not have combat troops in Afghanistan. It's long overdue. It should end.
61,8,0.983910504, We love it. We are not leaving it. We are here to stay. And we're certainly not going to leave it to you.
62,8,0.991264347, Well my response is that the senator has had several plans so far. And any time someone tells you you're going to get something good in 10 years you should wonder why it takes 10 years.
76,8,0.997841481,The fact of the matter is  the fact of the matter is that there will be a deductible. It will be a deductible on their paycheck. Bernie acknowledges it. Bernie acknowledges it. Thirty trillion dollars has to ultimately be paid. And I don't know what math you do in New York I don't know what math you do in California but I tell ya that's a lot of money and there will be a deductible. The deductible will be out of your paycheck because that's what will be required.
77,8,0.994572145,Real quick. I have the only plan that limits the ability of insurance companies to charge unreasonable prices flat out number one.
95,8,0.987436035, And by the way anybody that crosses the stage with a  with a  with a PhD you should get a green card for seven years. We should keep them here.
97,8,0.994004598,Lastly he also pointed out that we should go to the source of the problem and fix it where people were leaving in the first place. So he did  to compare him to Donald Trump I think is absolutely bizarre.
116,8,0.995041532, When Senator Harris was attorney general for eight years in the state of California there were two of the most segregated school districts in the country in Los Angeles and in San Francisco.
124,8,0.963331876, And that's bigger than any other person.
125,8,0.898283932, No I didn't say that.
141,8,0.963331876, Well I tell you what I hope you're part of it.
153,8,0.987436035, Because there was not full federal funding for all reproductive services prior to this point.
154,8,0.996538319," I did make a bad judgment trusting the president saying he was only doing this to get inspectors in and get the U.N. to agree to put inspectors in. From the moment ""shock and awe"" started from that moment I was opposed to the effort and I was outspoken as much as anyone at all in the Congress and the administration."
155,8,0.997340982,Secondly I was asked by the president in the first meeting we had on Iraq he turned and said Joe get our combat troops out in front of the entire national security team. One of the proudest moment of my life was to stand there in AlFaw Palace and tell everyone that we're coming  all our combat troops are coming home.
160,8,0.977634638,If you agree with me go to joe30330 and help me in this fight. Thank you very much.
169,8,0.996735411, Okay number one my health care plan does significantly cut the costs of ' the largest outofpocket payment you'll pay is $1000. You'll be able to get into a ' anyone who can't afford it gets automatically enrolled in the Medicaretype option we have et cetera.
184,8,0.963331876, Do not have to buy in if you can't afford it.
185,8,0.989694234, Your grandmother would not have to buy in. If she qualifies for Medicaid she would automatically be enrolled.
186,8,0.963331876, I said anyone like your grandmother who has no money.
187,8,0.977634638, She ' you're automatically enrolled.
210,8,0.995436198, What Latinos should look at is ' comparing this president to the president we have is outrageous number one. We didn't lock people up in cages. We didn't separate families. We didn't do all of those things number one.
215,8,0.898283932,RAMOS:
218,8,0.898283932,RAMOS:
221,8,0.898283932,RAMOS:
224,8,0.898283932,RAMOS:
229,8,0.898283932,RAMOS:
244,8,0.994572145,"And it was later when we came into office that Barack turned ' the president turned to me and said ""Joe"" ' when they said we've got a plan to get out he turned to the whole security and said ""Joe will organize this. Get the troops home."""
246,8,0.898283932, You're right.
254,8,0.987436035, I ' I never counted any professional setback like I have as a serious setback. There's things that are important. Things that are unimportant.
259,8,0.994004598,And then later when my son Beau came home from Iraq and ' with a terminal disease and a year later yearandahalf later losing him was like losing part of my soul.
260,8,0.99756667,But the fact is that I learned that the way you deal with it is you deal with finding purpose purpose in what you do. And that's why I hope ' I hope he's proud of me today because he wanted to make sure I didn't run for president but I stayed engaged because when you get hit badly whether you're losing a job or you're raising a family like my dad
261,8,0.99756667,And it just takes ' it just ' for me the way I've dealt with it is finding purpose. And my purpose is to do what I've always tried to do and stay engaged in public policy. And ' but there's a lot of people been through a lot worse than I have who get up every single morning put their feet one foot in front of another without the help I had. There are real heroes out there. Some real heroes.
263,8,0.995772669,This president ' and I agree with Bernie Senator Sanders ' is the most corrupt president in modern history and I think all of our history. And the fact is that this president of the United States has gone so far as to say since this latest event that in fact he will not cooperate in any way at all
267,8,0.995772669,Rudy Giuliani the president and his thugs have already proven that they in fact are flat lying. What we have to do now is focus on Donald Trump. He doesn't want me to be the candidate. He's going after me because he knows if I get the nomination
290,8,0.996315899, But here  look but here's the deal. Think what that did. He turns around and he questions whether or not he'll keep the sacred commitment of Article 5 for the NATO members. If he is reelected I promise you there will be no NATO. Our security will be vastly underrated under  we will be in real trouble.
305,8,0.995436198,The public is already there. Things have changed. And I would go out and I would campaign against those people in the state of Ohio Alabama et cetera who in fact are throwing up this barrier. Reproductive rights are a constitutional right. And in fact every woman should have that right.
315,8,0.898283932, And we can afford to do it.
321,8,0.898283932, I did not say back to normal.
380,8,0.995436198, Look I didn't say return to normal. Normal's not enough. Normal  in fact we have to move beyond normal whether it's health care the environment whatever it is. We have to build on what we had started in our administration
403,8,0.643579329, Oh American history.
410,8,0.996062934,And I have made sure that you know exactly where all the  and the largest contribution I have accepted is $2800 which is allowed under law. And I'm the first person to introduce the constitutional amendment to make sure that there is no  all public funding of elections. End all private funding.
411,8,0.99241929,And we all should take a commitment make a commitment to that right now on this stage. In the meantime you got to fund a campaign and we in fact have funded a campaign
437,8,0.995041532,The little kid who says I can't talk what do I do? I have scores of these young women and men who I keep in contact with. And the reason I would give everyone here a gift is because they want to do something like I do of making their lives better because there's a lot of people who are hurting very very very badly.
438,8,0.977634638, I want to thank everyone listening seven days out from Christmas. Thank you very much.
3,9,0.997211676,What I am saying is that we've got to be straightforward. We have to make sure we understand that to return dignity to the middle class they have to have insurance that is covered and they can afford it. They have to make sure that we  situation where there's continuing education and they are able to pay for it and they have to make sure that they are able to breathe air that is'is'is clean and they'they have water that they can drink.
4,9,0.997069151,Look Donald Trump has put us in a horrible situation. We do have enormous income inequality and one thing I agree honestly can make massive cuts in the $1.6 trillion in tax loopholes out there and I would be going about eliminating Donald Trump's tax cuts for the wealthy.
29,9,0.987436035,Because your city council made that decision. It was a local decision.
30,9,0.977634638,The'the federal government must'
47,9,0.996315899,Number two we increased that background check when'when'during the Obama administration. I'm also the only guy that got assault weapons banned banned and the number of clips in a gun banned. And so folks look
81,9,0.995772669,Absolutely not number one. Number two everything landed on the president's desk but locusts. I found that Julian  excuse me  the secretary we sat together in many meetings. I never heard him talk about any of this when he was the secretary.
