document,topic,gamma,text
334,3,0.995772669, It couldn't pass the United States Senate right now with Democrats. It couldn't pass the House. Nancy Pelosi is one of those people who doesn't think it makes sense.
337,3,0.997458827, I think a woman is qualified to be president and there's no reason why  if you think the woman is the most qualified person now you should vote for them. The reason why I think I should be president and be the nominee is number one I have brought people together my entire career. In the United States Senate I've passed more major legislation than everybody on this stage combined
340,3,0.99691127, Look I would not direct my Justice Department like this president does. I'd let them make their independent judgment. I would not dictate who should be prosecuted or who should be exonerated. That's not the role of the president of the United States. It's the attorney general of the United States not the president's attorney private attorney.
343,3,0.994572145,Look it's just  look it's about civility. We have to restore the soul of this country. And that's not who we are that's not who we've been that's not who we should be. Follow the law let the Justice Department make the judgment as to whether or not someone should be prosecuted
362,3,0.983910504, No I said the first. I said the first AfricanAmerican woman. The first AfricanAmerican woman.
366,3,0.996315899,You know the American people have an enormous opportunity. There's an incredible  incredible  I've never been more optimistic about our prospects in my entire career and I got elected when I was a 29yearold kid to the United States Senate.
370,3,0.995436198, You know Judy it was a constitutional necessity for the House to act as it did. And you know Trump's response to suggest that only half of the American people want to see him thrown out of office now I find
376,3,0.996062934, The answer is yes. The answer is yes because the opportunity  the opportunity for those workers to transition to highpaying jobs as Tom said is real. We're the only country in the world that's ever taken great great crises and turned them into enormous opportunities.
396,3,0.963331876, And I'm going to guess
405,3,0.983910504, Politico doesn't have much of a sense of humor.
430,3,0.977634638,I'm the only guy that's not interrupted.
431,3,0.995436198,I'm the only guy that's not interrupted here all right? And I'm going to interrupt now. It costs $30 trillion. Let's get that straight $30 trillion over 10 years. Some say it costs $20 trillion. Some say it costs $40 trillion.
435,3,0.996062934, I think everyone up here on this stage and those who are not on this stage who've run we owe them because they're all pushing for the exact same thing. You're not the only one that does selfies Senator. I've done thousands of them thousands of them. And the crew that follows me can tell you
440,3,0.99241929,Number two who can help elect Democrats to the United States Senate in states like North Carolina and Georgia and Arizona and other states?
442,3,0.996062934,And so I think asking those questions I believe as you would expect that I'm the most qualified to answer those three questions. But most of all we've got to level with the American people. Don't play games with them. Tell them the truth and be authentic.
6,4,0.998713341,I'm still holding on to that torch. I want to make it clear to you look the fact of the matter is what we have to do is make sure that everybody is prepared better to go on to educate for an education. The fact is that that's why I propose us focusing on schools that are in distress. That's why I think we should triple the amount of money we spend for Title I schools. That's why I think we should have universal PreK. That's why I think every single person who graduates from high school'65 out of 100 now need something beyond high school and we should provide for them to be able to get that education. That's why there should be free community college cutting in half the cost of college. That's why we should be in the position where we do not have anyone have to pay back the student debt when they get out they're making less than $25000 a year. Their debt is frozen. No interest payment until they get beyond that. We can't put people in a position where they aren't able to go on and move on.
15,4,0.998060518,But here's the deal. The deal is that he's right about three things. Number one they in fact contribute to the wellbeing of the country but they also'for example they've increased the lifespan of Social Security because they're'they have a job. They're paying the Social Security tax. That's what they're doing. It's increase the lifespan. They would do the same thing in terms of reducing the overall cost of healthcare by them being able to be treated and not wait until there in extremis.
22,4,0.995041532,close to immoral. But the fact is that look we should not be locking people up. We should be making sure we change the circumstance as we did why they would leave in the first place. And those who come seeking asylum we should immediately have the capacity to absorb them
58,4,0.993304504,Just look at this stage made up of very diverse people from diverse backgrounds went on to be mayors senators governors congresswomen
112,4,0.997211676,And the fact of the matter is secondly there was nothing done for the entire eight years he was mayor there was nothing done to deal with the police department that was corrupt. Why did you announce on the first day a zero tolerance policy of stop and frisk and hire Rudy Giuliani's guy in 2007 when I was trying to get rid of the crack cocaine disparity?
140,4,0.987436035, Well I love your affection for me. You spend a lot of time with me.
147,4,0.99691127,I wrote the Violence against Women Act. Lilly Ledbetter. I was deeply involved in making sure the equal pay amendments. I was deeply involved on all these things. I came up with the it's on us proposal to see to it that women were treated more decently on college campuses.
151,4,0.996735411,The Hyde Amendment in the past was available because there was other access for those kinds of services provided privately. But once I wrote the legislation making sure that every single woman would in fact be have an opportunity to have healthcare paid for by the federal government everyone that  that could no longer stand.
176,4,0.963331876, George 15 seconds? Fifteen seconds?
177,4,0.997340982, Fifteen seconds. Look everybody says we want an option. The option I'm proposing is Medicareforall ' Medicare for choice. If you want Medicare if you lose the job from your insurance ' from your employer you automatically can buy into this. You don't have ' no preexisting condition can stop you from buying in. You get covered period.
181,4,0.99241929,And we're talking four six eight ten years depending on who you talk about before we get to Medicareforall. Come on. I've been there. You've been there. You know what it's like. People need help now
194,4,0.778142202,When you finish your term in prison you should be able not only to vote but have access to Pell grants have access to be able to get housing
205,4,0.898283932, We are ready to do this.
237,4,0.99691127, No it wasn't wrong to pull out. But I want to answer your Afghanistan question. I've been in and out of Afghanistan not with a gun and I admire my friend for his service. But I've been out of Afghanistan I think more than anybody on this ' and it's an open secret you reported a long time ago George
269,4,0.996315899, Look my son's statement speaks for itself. I did my job. I never discussed a single thing with my son about anything having do with Ukraine. No one has indicated I have. We've always kept everything separate. Even when my son was the attorney general of the state of Delaware we never discussed anything so there would be no potential conflict.
271,4,0.584271299, First of all the plan we're hearing discussed is the  plan the one I built forward. Build on Obamacare add a public option. We can go into that. I can talk about that if you'd like.
282,4,0.997340982, I would not have withdrawn the troops and I would not have withdrawn the additional thousand troops who are in Iraq which are in retreat now being fired on by Assad's people. And the president of the United States saying if those ISIS folks escape from the prisons they're in they'll only go to Europe and won't affect us.
285,4,0.994572145, I would want those thousand troops to be protected by air cover those thousand troops that are being  having to withdraw under fire make it clear that they're not going anywhere and have them protected and work my way back toward what in fact
296,4,0.987436035, Because I've watched it. I know what the job is. I've been engaged.
298,4,0.998060518,It is required now more than any time in any of our lifetimes to have someone who has that capacity on day one. That's one of the reasons why I decided to run why I decided to run this time because I know what has to be done. I've done it before. I've been there when we pulled the nation out of the worst financial recession in history. I've been there and I've got so many pieces of legislation passed including the Affordable Care Act as well as making sure that we had the Recovery Act
306,4,0.994004598,And so I would not pack the court. What I would do is make sure that the people that I recommended for the court from Ruth Bader Ginsburg to Elena Kagan who used to work for me to others that they in fact
312,4,0.99241929, If you eliminated the entire Pentagon every single thing plane ship troop the buildings
317,4,0.996315899, The greed and profiteering of those insurance companies they are as much against my bill as they are anybody else. They were strongly against Obamacare. They know it cost them. And it's going to take away the right of people to choose the 160 million people out there who've negotiated their health insurance and they want to keep it. They should have a right to keep it.
319,4,0.977634638, You did a hell of a job in your job.
348,4,0.997458827, Well first of all I'd go back in making sure we had the alliances we had before since he became president. He has absolutely ostracized us from South Korea. He has given North Korea everything they wanted creating the legitimacy by having a meeting with Kim Jongun who's a thug  although he points out that I'm a rabid dog who needs to be beaten with a stick very recently was his comment.
355,4,0.995436198, Yes. And by the way it's one of the reasons  the first thing I would do is make sure we pass the Violence Against Women Act reauthorization which I wrote. The fact  I didn't write the reauthorization. I wrote the original act.
371,4,0.994004598,You know we need to restore the integrity of the presidency the office of the presidency and it's about time we get that underway. My job and I think the job of all of us up here is to in fact  well that's not true
373,4,0.995436198,You have for example farmers in the Midwest 40 percent of them couldn't pay their bills last year. You have most Americans if they received a bill for $400 or more they'd have to sell something or borrow the money.
378,4,0.996315899,We have enormous opportunities. For example you talk about would we relocate people who in fact were in a position where they lost their home? We have to not rebuild to the standard that existed before when we talk about when we come in and help people. We have to rebuild with the standard that exists today.
393,4,0.99241929,Secondly we in fact should make sure that we begin to rebuild our alliances which Trump has demolished with Japan and South Korea
414,4,0.996538319,The people who come here have determination resilience. They are ready to stand up and work like the devil. We have 24 out of every 100 children in our schools today is Hispanic. The idea that we are going to walk away and not provide every opportunity for them is not only stupid and immoral but it's bad for America.
424,4,0.996538319,But now that it's been exposed that taking it away has such dire consequences I've added to the Obamacare plan the  initiative which is a public option Medicare if you want to have Medicare reducing significantly the price of drugs
43,5,0.995772669,I think you've so underestimated what Barack Obama did. He's the first man to bring together the entire world 196 nations to commit to deal with climate change immediately.
46,5,0.995041532,Okay. I'm the only person that's beaten the NRA nationally. I'm the guy that got the Brady Bill passed the background checks number one.
105,5,0.995436198,That's the essence of what my plan in detail lays out. I'm happy to discuss it more in detail if the senator would want to. And so I  you know I look  anyway that's what I think my plan  I know what my plan does and I think it's not dissimilar to what the senator said we should be working together on getting things done.
111,5,0.994004598, Number one the bill he talks about is a bill that in my  our administration we passed. We passed that bill that you added onto. That's the bill in fact you passed.
121,5,0.997665732,But h's the deal; in area there's also another piece. Eightyfive percent of it is something I helped negotiate; and that is the Paris Climate Accord. I would immediately rejoin that Paris Accord. I would make sure that we up the ante which it calls for. I would be able to bring those leaders together who I know I  I convene them in the White House like we did in nuclear summit and I would raise the standard.
123,5,0.987436035,  in research for new alternatives to deal with climate change.
129,5,0.994004598, Because we did it. I was asked to manage an $87 billion plan that would be spent in a total of 18 months that revived this state and many others because  and it kept us out of a depression with 0.2% of waste or fraud.
135,5,0.998060518, I would not rejoin the TPP as it was initially put forward. I would insist that we renegotiate pieces of that with the Pacific nations that we had in South America and North America so that we could bring them together to hold China accountable for the rules of us setting the rules of the road as to how trade should be conducted. Otherwise they're going to do exactly what they're doing fill the vacuum and run the  and run the table.
162,5,0.997211676,I refuse to postpone giving single child in America no matter their Zip code preK all the way through high school and beyond. I refuse to postpone any longer taking on climate change and leading the world in taking on climate change.
172,5,0.99691127,The senator said before it's going to cost you in your pay ' there will be a deductible in your paycheck. You're going to ' the middle class person someone making 60 grand with three kids they're going to end up paying $5000 more. They're going to end up paying 4 percent more on their income tax. That's a reality. Now
190,5,0.996735411,I've been involved from the beginning. As a young congressman ' as a young councilman I introduced legislation to try to keep them from putting a sewer plant in a poor neighborhood. I made sure that we dealt with redlining; banks should have to lend where they operate et cetera.
192,5,0.996735411,Nobody should be in jail for a nonviolent crime. As ' when we were in the White House we released 36000 people from the federal prison system. Nobody should be in jail for a drug problem. They should be going directly to a rehabilitation. We build more rehabilitation centers not prisons.
200,5,0.99241929,Over 90% of the American people think we have to get assault weapons off the street ' period. And we have to get buybacks and get them out of their basements.
208,5,0.994572145," No what I said was ' the question ' speak to constitutional scholars. If in fact we could say ""By the way you can't own the following weapons period; they cannot be sold anymore"" ' check with constitutional scholars. Now you can say"
211,5,0.996735411,Number two ' number two by the time ' this is a president who came along with the DACA program. No one had ever done that before. This is the president that sent legislation to the desk saying he wants to find a pathway for the 11 million undocumented in the United States of America. This is a president who's done a great deal. So I'm proud to have served with him.
213,5,0.993304504,I would change the order that the president just changed saying women who were being beaten and abused could no longer claim that as a reason for asylum.
235,5,0.994572145,In addition to that we're in a position where if we don't set the rules we in fact are going to find ourselves with China setting the rules. And that's why you need to organize the world to take on China
238,5,0.995772669,The whole purpose of going to Afghanistan was to not have a counterinsurgency meaning that we're going to put that country together. It cannot be put together. Let me say it again. It will not be put together. It's three different countries. Pakistan owns the three counties ' the three provinces in the east. They're not any part of ' the Haqqanis run it. I will go on and on.
239,5,0.996735411,But here's the point. The point is that it's a counterterrorism strategy. We can prevent the United States from being the victim of terror coming out of Afghanistan by providing for bases ' insist the Pakistanis provide bases for us to air lift from and to move against what we know.
249,5,0.997458827,The teachers are ' I'm married to a teacher. My deceased wife is a teacher. They have every problem coming to them. We have ' make sure that every single child does in fact have 3 4 and 5yearolds go to school. School. Not daycare. School. We bring social workers in to homes and parents to help them deal with how to raise their children.
253,5,0.996538319,Number two you talk about the need to do something in Latin America. I'm the guy that came up with $740 million to see to it those three countries in fact changed their system so people don't have to chance to leave. You're all acting like we just discovered this yesterday. Thank you very much.
294,5,0.997211676,The way to deal with those guns and those AR15s and assault weapons that are on the street  or not on the street that people own is to do what we did with the National Firearms Act as it related to machine guns. You must register that weapon. You must register it. When you register it the likelihood of it being used diminishes exponentially.
336,5,0.995436198,But here's the deal they get to choose. I trust the American people to make a judgment what they believe is in their interest and not demand of them what the insurance companies  they want no  no competition. And my friends say you have to only go Medicare for all.
345,5,0.997211676, Distinction should he be impeached and should he be thrown out of office? That's one question. He's very close to  he's indicted himself. Number two after he's thrown out of office or after he's defeated should he be then prosecuted? Should he be prosecuted for a criminal offense while he was president? That's a judgment to be made by an attorney general.
346,5,0.998341084, Yeah I was. I think it is the existential threat to humanity. It's the numberone issue. And I might add I don't really need a kind of a lecture from  from my friend. While I was passing the first climate change bill and that PolitiFact said was a gamechanger while I managed the $90 billion recovery plan investing more money in infrastructure that related to clean energy than any time we've ever done it my friend was introducing more coal mines and produced more coal around the world
347,5,0.994004598,Now he's  I welcome him back into the fold here and he's been there for a long while. But the idea that we talk about where we started and how we are let's get this straight. I think it is the existential threat of all time.
353,5,0.995436198,And I would also as pointed out I would end  end subsidies that we have end the sale of material to the Saudis where they're going in and murdering children and they're murdering innocent people. And so they have to be held accountable.
377,5,0.994572145,I've met with the union leaders. For example we should in fact be making that  making sure right now that every new building built is energy contained that it doesn't leak energy that
383,5,0.987436035,But the fact is we have to  we have to be able to get things done. And when we can't convince them we go out and beat them like we did in the 2018 election in red states and in purple states.
385,5,0.996735411,Look what we have done around the world in terms of keeping Guantanamo open or what Trump has done by no longer being an honest broker in Israel there's no solution for Israel other than a twostate solution. It does not exist. It's not possible to have a Jewish state in the Middle East without there being a twostate solution.
386,5,0.994004598,And he has played to all the same fears and all the prejudices that exist in this country and in Israel. Bibi Netanyahu and I know one another well. He knows that I think what he's doing is outrageous.
387,5,0.994572145,What we do is we have to put pressure constantly on the Israelis to move to a twostate solution not withdraw physical aid from them in terms of their security.
402,5,0.963331876, More like Winston Churchill.
406,5,0.991264347, No I'm not willing to commit one way or another. Here's the deal. I'm not even elected one term yet and let's see where we are. Let's see what happens.
407,5,0.898283932,But it's a nice thought.
421,5,0.835123035, I'm talking about the White House.
10,6,0.989694234,And secondly secondly to make sure that everyone does have an option. Everyone whether they have private insurance employer insurance or no insurance they
12,6,0.987436035,I'm sorry. I beg your pardon. I didn't hear.
20,6,0.898283932,That is outrageous.
21,6,0.996315899,Depending if they committed a'a major crime they should be deported. And the President was left in his'President Obama I think did a heck of a job. To compare him to what'what this guy is doing is absolutely I find'
27,6,0.996315899,But'so the bottom line here is look everything I have done in my career'I ran because of civil rights. I continue to think we have to make fundamental changes in civil rights. And those civil rights by the way include not just African Americans
36,6,0.643579329,But sometimes you can't do that. Sometimes you just have to go out and beat them. I went into 20 states over 60 candidates'
42,6,0.997757044,And new science and technology to be the exporter not only of the green economy but economy that can create millions of jobs. But I would immediately rejoin the Paris Climate Accord. I would up the ante in that accord which it calls for because we make up 15 percent of the problem; 85 percent of the world makes up the rest. And so we have to have someone who knows how to corral the rest of the world bring them together
59,6,0.991264347,Mr. President this is America. And we are stronger and great because of this diversity Mr. President not in spite of it Mr. President.
67,6,0.993304504,It would take place immediately. It would move quickly. And it would insure the vast vast vast majority of Americans.
69,6,0.993304504, My plan makes a limit of copay to be $10 because we further support the  the ability to buy into the Obamacare plan.
70,6,0.994004598,Secondly the idea that this is somehow a bad idea no one has to keep their private insurance but they  if they like their insurance they should be able to keep it. Nothing is demanded in my plan that there be private insurance.
71,6,0.991264347,It says if the 160 million who have it say they like their employer insurance they should have a right to have it. If they don't they can buy into the  plan which is Obamacare with 
72,6,0.995436198,My plan does  will cover everyone number one. Number two the fact is that my plan also calls for controlling drug prices. The biopharma is now where things are going to go. It's no longer chemicals. It's about all these breakthroughs that we have with the whole  excuse me immune system.
73,6,0.995436198,And what we have to do now is we have to have a form that sits in HHS and says as you develop a drug you got to come to us and decide what you can sell it for. We will set the price. And secondly it says that you cannot raise that price beyond the cost of inflation from this point on.
74,6,0.996538319,This is not a Republican talking point. The Republicans are trying to kill Obamacare. Obamacare took care of 20 million people right off the bat 100 million people with preexisting conditions. And in fact what we got is a public option that in fact would allow anybody to buy in.
75,6,0.996538319,No one has to keep their private insurance. They can buy into this plan. And they can buy into it with $1000 deductible and never have to pay more than 8.5 percent of their income when they do it. And if they don't have any money they'll get in free. So this idea is a bunch of malarkey what we're talking about here.
78,6,0.993304504,Number two we should put some of these insurance executives who totally oppose my plan in jail for of the $9 billion opioids they sell out there.
82,6,0.898283932,Three million 
84,6,0.898283932,Three million 
85,6,0.977634638,I don't know if you can hear. I can hear. But anyway
106,6,0.987436035, The fact is that the bills that the president  that excuse me the future president here  that
107,6,0.995041532, that the senator is talking about are bills that were passed years ago and they were passed overwhelming. Since 2007 I for example tried to get the crackpowdercocaine totally  disparity totally eliminated.
130,6,0.993304504,Secondly I was part of the organization  and within our administration  that pushed bailing General Motors out saving tens of thousands of jobs here in this state.
