doc_id,text
838,tensions tariffs creating economic uncertainty bloomberg global business forum critical time business govt leaders convene focus expanding trade driving economic growth tackling global challenges
839,uniting global leaders public private sector dialogue bloomberg global business forum powerful counterweight talk trade wars spur investment economic growth world
840,mayors financing biggest barrier action climate change
841,congratulations jeremy shiffman leading scholar global health policy political science
842,koreatown la built aapi immigrants represents people country contribute economically culturally it’s vital america local community leaders
843,study led scientists convened
844,piloted nyc financial empowerment center services helped clients improve futures
845,london mastaba brings benefits public art inviting energy provoking conversation
846,wake sports played role recovery nyc country
847,podcast
848,cities address climate pollution set agenda country
849,congress failed legislatively constitutionally leadership assert congress equal branch government midterm elections supporting democrats amp bid house statement
850,tearing innocent children parents american months ago spoke
851,encourage consumers healthier choices peru requires warning labels food beverages sugar sodium saturated fat trans fat congrats ministry health
852,report
853,issue i’m involved women leading moms demanding gun violence women walking schools support climate justice defeat trump women rose womensmarch
854,businesses account half uks gdp productivity accelerates growth glad host rethinking productivity conference london discuss
855,step flight time
856,london mastaba continues
857,display october year’s
858,chief minister visiting
859,campaign national political chair philadelphia mayor
860,administration regulators refuse administrations false claim closing coal plants national security emergency
861,nyc we’ve christos visionary projects benefit cities culturally economically week london mastaba bring benefits hyde park fwd sculpture amp
862,german government’s coal commission begin move
863,cities determined lead climate action american cities climate challenge country’s ambitious mayors move faster achieving goals
864,putting students broadening educational opportunities yr college degree career amp technical training
865,statement san francisco’s vote uphold law banning flavored tobacco nicotine products
866,tech companies world safe
867,glad meet
868,finished california climate change tour speaking community monterey ca told told country
869,prevent ncds report
870,walking climate goals progress accelerating american cities climate challenge mobilize action reduce emissions growing local economies
871,statement administrations plan bail failing coal plants colossally bad idea
872,bailing polluting unprofitable coal plants national security special washington fighting policy span political spectrum
873,federal government paris agreement cities continue drive ambitious climate action
874,don’t miss ken auletta’s book frenemies provocative ongoing shift global advertising means future media
875,wearorange support millions americans standing
876,anniversary washington’s decision withdraw paris agreement leaders cities businesses taking action advance america’s commitment cleaner healthier future
877,it’s washington pulled paris agreement hasn’t stopped cities businesses taking climate action joining
878,washingtons decision withdraw paris agreement prompted action cities
879,week released agenda fight climate change reducing emissions buildings vehicles targeting biggest sources pollution amp improving resiliency consequences climate change plan america green
880,districts schools deliver results college career readiness goals
881,date billion people world protected
882,data driven initiatives strong partnerships
883,data doesn’t answers requires creativity innovative solving data anchor thinking reality time political debate increasingly untethered
884,leadership ceo
885,book
886,strengthening cities strengthen america goal
887,global change begins cities learn
888,annual letter philanthropy
889,account global deaths people unaware ncds
