doc_id,text
251,senator
252,join fight donald trump donate democratic party givingtuesday difference state’s democratic party donate
253,nra’s effort undermine public safety absurd dangerous supreme court millions americans fighting gun safety send nra packing
254,favorite holiday traditions taking family final preparations macysparade wishing happy thanksgiving
255,support israel refuse israel wedge issue electoral purposes trump americans choose supporting israel amp values home defend inextricably linked
256,beat trump build broad coalition voters ready unite rebuild america swing red blue win hes campaigning day office
257,applaud nyc council banning sale flavored cigarettes donald trump bidding tobacco industry cities taking strong action youth cigarette epidemic communities act protect kids
258,filed arizona ballot democratic primary it’s time rebuild america join
259,arizona crucial battleground trump spending money az red blue it’s i’m meeting voters
260,takes beat trump
261,i’m kicking presidential campaign norfolk southeastern virginia proves candidate red blue
262,democratic national convention donald trump ran country ran business we’d lot trouble that’s happened
263,child boy scout taught promise potential america worried future
264,afford president trump’s reckless unethical actions stakes win election begin rebuilding america
265,trump admin lacking courage stand tobacco industry critical cities step ma’s bill ban sale flavored tobacco products model hope
266,eve anniversary liberation auschwitz addressed jewish community broward county fl message inclusion tolerance unity fight preserve
267,voting sacred matters that’s i’m committing registering voters battleground ahead election
268,president trump won’t steps protect children office
269,hands deck moment taking fight trump directly
270,im horrified familiar images mass shooting america heart victims santa clarita it’s past time common sense gun laws country children deserve feel safe schools we’re failing
271,sister paulette service city
272,ago flight crashed belle harbor queens killing people board ground devastating day city affected families mornings spent beautiful memorial rockaway beach
273,enjoyed meeting rock’s impressive mayor
274,officially filed arkansas ballot democratic primary defeat trump failed
275,women served protect country
276,juul ballot proposition san francisco voters overwhelmingly rejected forcing juul drop campaign embolden cities action protect childrens health
277,i’m stand fight proud americans proud jews i’m celebrating launch unitedformike florida watch live
278,it’s lead climate action president won’t
279,abandoning paris agreement abdication leadership vast majority americans oppose americans action climate change public deliver washington wont
280,americans fall victim marketing tricks tobacco convince vaping safer regular cigarettes it’s launched
281,automakers failed learn lessons past american consumers reward companies offer fuel efficiency ill continue supporting attorneys push trump administrations opposition standards
282,citylabdc wraps
283,people resource city congratulations engaged cities award winners flint san francisco plymouth thankful empower citizens tackle pressing issues world
284,public art power reshape experience cities we’re share experience enliven streets plazas world
285,i’ve lived york i’ve subway it’s lifeblood nyc glad celebrate birthday
286,preparing address jewish american community broward county fl hope youll watch
287,cities delivering results difference peoples lives
288,mayors solutions mayor difference conversation
289,mayors exchange ideas improve lives cities world glad spend day talking learning city leaders
290,weekend i’ll leading minds government business art activism world citylabdc leaders exchange ideas improve lives cities world
291,children benefit hearing words age providence talks inaugural
292,trump admin flavored cigs market decision overwhelming bipartisan support days waiting plan doesn’t ban mint menthol plan stand tobacco industry amp honor commitment
293,eradicating polio public health achievements history worldpolioday we’re honoring
294,blustering campaign rally president speak climate leaders mayor
295,president trump listen people pittsburgh mayor
296,military lives line safe return home feel adrift failures nation heres plan increase opportunities veterans
297,cigarette epidemic reaching breaking episode
298,juul’s announcement late decision mint menthol flavored cigs shelves page tobacco industry’s playbook
299,day flavored cigarettes market public health children risk
300,elijah cummings devoted champion baltimore strong voice issues including civil rights gun safety oversight executive branch honor carry tireless baltimore amp congress
301,democratic presidential candidates aren’t short ideas voters demand explain intend move proposing plans implementing
302,week joined mayor
303,climate crisis inaction national level excuse change year’s
304,americans aisle overwhelmingly agree health citizens ban flavored cigarettes
305,cities world taking bold climate action proving climate progress city level congratulations cawards winners outstanding climate leadership medellín kolkata seoul accra london san francisco guangzhou
306,president wields bully pulpit twitter account demean women president protect rights health women undermine womenformike
307,community enact global change i’ve meaningful action cities mayor york city world honor leading cities leading climate action cawards watch live
308,selected cities data driven strategies playbook mayors country create climate action playbook giving cities tools climate action
309,join mayors american cities climate challenge
310,bold successful climate policies mayor
311,mayor
312,banning flavored cigarettes reduce cigs kids teens
313,mayor
314,republicans follow
315,congress stand president violates oath office abuses power personal gain solicits foreign interference american elections
316,ceos ed stack address gun violence waiting congress glad join
317,protect lgbtq americans transgender women color harm criminal justice system we’ll require training law enforcement de escalation implicit bias we’ll reverse ban transgender individuals serving military
318,american dream i’ve lived i’m running president ensure chance
319,tomorrow
320,glad
321,future business role society teamed
322,jessye norman american treasure york philanthropic service honored nyc’s cultural honor handel medallion voice live
323,resources training verbal autopsies data health initiative developing countries gather information health citizens glad partner australian govt amp
324,data essential solving worlds toughest challenges we’re reinvesting build success data health initiative partners governments developing countries gather accurate data citizens health
325,bloomberggbf week disney’s
326,politicians aren’t hard science political science message reality climate change music election day
327,climate leader prime minister
328,consequences climate change catastrophic don’t act president i’ll accelerate america’s transition carbon economy
329,special president george bush lady
330,climate action businesses individuals
331,geopolitical issues require geo economic thinking solutions bloomberggbf
332,addressing concerns cigarettes emergency legislation
333,bridge gap climate finance emerging markets climate action climate finance leadership initiative association european development finance institutions partnering bloomberggbf
334,collaboration government business critical meeting world’s pressing challenges bloomberggbf leaders committed partnering solutions address climate change growing economy
335,india’s economic growth success stories century pm
336,bloomberggbf influential leaders chance share ideas conversations happen meet moment restore global stability
337,commissioner
338,trumps dismissal traumatic brain injuries insult veterans suffer injuries brave women uniform continue harms sadly pattern
339,taking climate action prime minister
340,pm
341,heads delegations ceos bloomberggbf address threats global prosperity economic environmental instability
342,prime minister
343,join conversation prime minister
344,watch live heads ceos bloomberggbf ny
345,leaders joining bloomberggbf understand increasingly polarized world it’s critical public private sectors talk listen
346,data powerful tools fight climate change
347,heads ceos gathered bloomberggbf set shape future i’m optimistic accomplish watch event live starting
348,america meaningful lasting solutions challenges defeating trump rebuilding america urgent fight lives i’m join
349,tomorrow i’ll heads ceos annual bloomberggbf including pm
350,programs community mayor providence ri’s childhood development program won
351,coal free future grasp
352,recent wildfires amazon disturbing destruction climate change bring
353,climate crisis requires urgent action glad join
354,we’re living age marked growing polarization economic tensions climate science denial that’s im convening heads amp ceos collaborate solutions addressing global economic amp environmental instability bloomberggbf
355,phasing coal slows climate crisis creates jobs saves lives congratulations powering past coal alliance
356,nra spent roughly helping trump win presidency nra expected return investment don’t contributions elected people owe american people
357,forward speaking week prime minister
358,week i’m bringing heads business leaders collaborate solutions addressing economic amp environmental instability join bloomberggbf conversation online watch live starting
359,conversation president
360,candidates talk plans climate crisis climateforum tomorrow
361,mayors business leaders artists world discuss challenges cities power drive solutions forward citylabdc
362,trump epa wrong waiver science market politics lose marketplace court public opinion we’ll fight courtroom
363,pm
364,economic growth climate action competing ideas hand hand glad share climate finance leadership initiative report roadmap reducing emissions strengthening economies
365,chairman peter grauer terrific job advancing gender diversity
366,join york city campaign hq attend special event january trip includes airfare night hotel accommodations winner guest enter
367,data scientists engineers experts
368,political rage crowding constructive dialogue restoring ability disagree mortal enemies urgent civic imperative
369,september bloomberggbf bring world leaders incl pm
370,forward conversation india prime minister
371,i’m forward hearing candidates democratic field share plans address climate crisis tonight’s demdebate dont agree candidates single president trump
372,statement
373,difficult inspiring morning lower manhattan hope americans world chance experience power
374,forget
375,trumps decision speak marchforlife administrations relentless assault women march voice opinion preclude womans decisions body
376,million kids cigarettes cig makers tobacco companies preying america’s youth we’re launching
377,banning flavored cigarettes reduce cigs kids teens join
378,decline youth smoking health victories century cigarettes threaten reverse progress im announcing initiative
379,trump administration continues fossil fuel industry legal challenge shameful attempt avoid embarrassment americans pay price pollution health greenhouse gasses
380,food livelihood habitat billion people marine species depend oceans live climate crisis threat
381,cities creative solutions complex challenges limited resources partnership ministry interior
382,cities businesses citizens taking action clean air affordable energy jobs stories don’t told sat
383,leadership
384,changing quickly
385,businesses country stepping citizens mayors law enforcement authorities private sector lead senate
386,coronavirus outbreak demands attention potential epidemic line defense public health professionals cdc funded empowered jobs
387,flavored cigs fueled spike youth threatens undo generations worth progress
388,hoy
389,roll methane regulations trump administration siding special continue local leadership achieve climate progress elect climate leaders
390,cities leading issues opportunities executive development mayors city leaders world
391,confronted tragedy mayor
392,fires amazon rainforest international emergency accelerate climate crisis responsible action future planet stake actfortheamazon
393,john mccain understood progress requires civil dialogue hold views it’s follow actsofcivility
394,national inaction continue push country forward climate week
395,can’t battleground minnesota granted democratic margin victory barely votes that’s we’re waiting organize invest minnesota office minneapolis
396,moment pass
397,discuss importance leadership recognizing staff takes build team innovative senior staff joined
398,favorite
399,leaders
400,speak
401,spoke
402,americans nation calling common sense gun reform im optimistic meet moment bring change communities
403,democrats unified gun safety we’ll voter america understands choice candidates stand family’s safety bow special
404,words america’s philosophers cookie pleasure spend afternoon
405,unity gun safety democratic presidential candidates entire democratic party translate unity action washington
406,americans accept toll gun violence takes communities country we’re washington strong gun sense movement grown voting block progress
407,gun sense movement million strong midterm we’ll candidates dont lead gun safety we’ll vote election day gunsenseforum
408,speaking
409,time issue gun violence front center election tune presidential gunsenseforum live
410,mayors leading front gun safety founded mayors illegal guns advocate life saving policies hundreds
411,winner bloomberg american cities climate challenge boston leading
412,momentum gun safety movement time political inaction continues tragic toll saturday ill join
413,house action gun violence including passing comprehensive background check bill senate republicans failed act change americans demand
414,restore leadership lgbtq issues home abroad appoint cabinet staff represent diversity country honor lgbtq vets service protect displaced persons promote rights lgbtq people abroad
415,toni morrison forever voices american literature honor nyc literary honors words continue play role country’s cultural fabric
416,time that’s minds americans reward political leaders protect public safety drive don’t public office moment pass
417,voters candidates strong positions gun safety reward
418,friends partners examples citizen action
419,past strengthened gun laws bills passed democrats republicans time energy passion
420,climate crisis warning signs fight time move
421,ahead democraticdebate detroit poll voters michigan action climate crisis tonight tomorrow voters deserve discussion reflects priorities
422,home america’s universities hospitals home hundreds thousands america’s proudest people resilient strong wearebaltimore
423,term partner
424,cutting energy consumption creating art sparks conversation ecology conservation climate leadership takes forms don’t miss ackroyd amp harvey’s installation living artwork oaks
425,pulse nightclub shooting
426,california toe toe trump administration’s rollbacks winning deal deliver fuel efficient vehicles entire country drive progress fight climate crisis
427,bloomberg global business forum unique opportunity world leaders build partnerships share ideas combat current threats global prosperity rise economic environmental instability bloomberggbf
428,president tells forward forward
429,improving american education system top priority country
430,derrick continued leadership encouraging fight
431,education holds key major challenges zip code skin color determined child’s education tragically wrong amp fixing top priority country amp president
432,cities play key role improving public health mayors
433,robert morgenthau dedicated life york safer city played central role bringing crime historic lows legacy
434,carry american spirit taking moonshots explore space save planet climate crisis that’s launched
435,tough cigs limited evidence cigarettes adult smokers quit credible evidence flavored cigarettes contrast evidence flavored cigarettes attract kids
436,climate leadership country
437,mayors frontline issue hear leaders
438,weakening enforcement fuel efficiency standards pollute air harm climate president administration putting industry ahead health future
439,ive believed businesses responsibility forge real positive change climate action movement speak
440,cities power drive meaningful progress biggest issues time that’s row i’m glad mayors world kick bloomberg harvard city leadership initiative
441,i’m forward hosting mayors world week partnership
442,president america’s environmental leadership watch simple truth remains it’s cities fighting administration block progress
443,opioid epidemic continuing impact individuals families communities country teaming pennsylvania leaders address crisis washington slow act
444,that’s increased life expectancy york time city hall alongside partners
445,progress cleaning air protecting health cutting carbon emissions happened spite president claim credit leadership cities businesses won’t fooled
446,there’s difference talk action that’s difference donald trump
447,tackling climate crisis wait national governments act ldnclimateaction cities mayors
448,uk government’s greenfinance strategy sets leading call publicly listed companies asset owners disclose climate related risks amp opps builds
449,it’s simply bad business ignore impact climate crisis business leaders recognizing risk moving
450,move
451,luis alvarez nypd detective spent months ground rescue recovery fighting congress joined lost battle cancer lost true hero it’s finish
452,president’s attempt undermine global climate goals betrays trust allies poses danger action international community meet threat climate change
453,night’s energy candidates climate crisis encouraging progress wait president act
454,employees libraries schools public agencies michigan trained deliver naloxone prevent opioid overdoses commend
455,americans deserved discussion climate crisis tonights demdebate we’re waiting address emergency
456,president govern elected ill progressive partners level government country signed ballot pledge partner orgs
457,owe generation reject dirty air life
458,investors lack reliable data climate change impact companies can’t allocate resources reward action sit
459,leaders mayor
460,transitioned successful maternal reproductive health program tanzania govt key partners start congrats partners amp govt committed sustain amp scale model country
461,solutions global challenges whats world leaders ready ideas reality share solution
462,retweet agree move faster fight climate crisis
463,climate leader gov mark carney committed stress testing uk financial system climate risk cut
464,solving climate crisis demands action society that’s critical financial sector accounts impact activities climate
465,launched
466,women military bravest patriotic honorable people country deserve president president disrespects military disrespects america
467,team
468,inviting foreign powers meddle elections unacceptable president
469,foreign election meddling wrong president
470,philanthropy can’t replace action federal government spur progress bottom local leaders faster
471,enormous challenges washington remains gridlocked climate crisis opioid epidemic proposing ideas isn’t action
472,leave planet healthier stronger found
473,im honored receive recognition call
474,trump’s plan reverse auto emission standards line attacks environment national security public health economy defies logic can’t wait move
475,stakes save planet climate change tasked
476,climate crisis accelerates oceans act
477,mayor
478,wait act climate change
479,challenge stop climate change unlike faced humankind graduates
480,i’m launching initiative move
481,starting
482,building success coal campaign i’m committing million launch
483,celebrating mit boston roots forward addressing
484,billion people worldwide depend oceans livelihood climate crisis speeding immense responsibility global community defend ocean ecosystems destruction worldoceanweek
485,hope you’ll join wearorange friday speak common sense gun policies senseless gun violence claims lives fellow americans tomorrow honor victims survivors demonstrating commitment change
486,what’s climate business investors paying attention stepping address climate crisis
487,nation’s streets bridges transit systems falling biggest roadblock president doesn’t follow promises plan act
488,american cities climate challenge proven climate goals reach matter white house president pulled paris agreement collective emissions reductions equivalent closing coal burning plants
489,uk taking leaps strides carbon reduction goals milestones prove move
490,tobacco world’s leading agent preventable death worldnotobaccoday i’m recommitting protecting people harmful effects there’s excuse inaction
491,congress rein trump’s trade policy powers it’s late
492,i’ve involved gun safety movement energy progress wouldnt
493,obligation reject traffic blatant dishonesty deceit dont politics degenerate ability address challenges hbs
494,months countless heroes clock dangerous conditions city rebuild anniversary recovery efforts dedicate memorial glade ill died related attacks
495,americans questioning moral leadership washington economically politically respond bringing ethics business message
496,afternoon
497,forward cambridge tomorrow speak year’s
498,obsessed shouldnt easy distract president united
499,president trump failed climate change preventing scientists monitoring reporting carbon emissions climate warning signs inexcusable can’t won’t wait washington discover reason
500,failure
501,meet challenges time risks defiance odds message
502,terps it’s honor speaking college park umd commencement tune pm
503,yrs ago car drove straight broadway times square pedestrian plaza completion it’s nyc’s iconic safer cleaner amp business friendly it’s cities world replicating success
504,week’s elections europe critical eu’s continued leadership fighting climate change protectionism biggest require global cooperation urge eu citizens vote euelections
505,congrats philly mayor
506,front conference mayors voiced support dc voting rights president ill congress happen
507,washington continues ignore deny climate crisis progress bottom week st louis country real leadership
508,statement brazilian government’s lawsuit tobacco companies
509,changing math epa calculates dangers air pollution administration putting industry american people
510,hosting pm
511,forward bringing bloomberg
512,honored bloomberg
513,overcome biggest challenges start reclaiming civic dialogue debasing degrading preventing washu
514,meet zaria
515,congratulations
516,message
517,protect lgbtq community schools safer inclusive discrimination adoptions ban conversion therapy
518,it’s people country don’t access clean drinking water that’s unacceptable plan remove forever chemicals provide americans access clean water time act
519,morning
520,st louis mayor
521,universities force innovation fighting climate change
522,i’m forward speaking class
523,calgary’s mayor
524,trump administration prop coal industry plants closing fast milestone plants retired trump office america continues move beyondcoal matter washington
525,voters speaking loud climate action top priority
526,people worried climate change future stake i’m forward meeting graduates leading issue coming weeks commencement ceremonies country
527,jeter eli nyc celebrate time legends true champion franchise beating pats super bowl salute forever
528,trump promised run nation ran businesses
529,imf estimates fossil fuels artificially propped trillion subsidies total global gdp words literally paying accelerate climate change consequences
530,usvi recovery effort continues friend
531,findings report reminder build sustainability environmental policy economic decisions it’s late avoid version future act fast
532,i’m glad
533,time renewable energy projected generate power coal fired plants congrats
534,it’s powerful
535,science technology fight planet’s deadliest animal mosquito support
536,nra meets annual convention crisis mode
537,data helps cities understand measure success holds government accountable cities earned certification
538,outrageous wheelchair users travel amtrak charged nations transportation accessible americans
539,fight climate change vote people honor earthday simple actions courtesy sustainability leaders helped cities win american cities climate challenge
540,empowered cities drivers progress innovation glad friend jamie dimon
541,active fight climate change decade ago addressing challenge environment health economy earthday stand people globe taking action
542,promise world meet paris agreement goals administration won’t hold deal american people
543,mueller job it’s
544,couldn’t agree cities incubators innovation action pressing challenges facing planet communities progress
545,vote sacramento ca banning flavored tobacco products embolden cities act protect children targets tobacco cigarette companies
546,friend
547,learn zealand’s leadership unspeakable tragedy tune
