doc_id,text
548,innovative power lighting water ventilation
549,mayor filled million potholes nyc didnt president billion annual pothole fund emergency repairs
550,chicago’s decision transition clean energy real local leadership american cities climate challenge helping cities chicago accelerate progress ambitious commitments reality
551,giving community
552,governor hugh carey saved york ny stands testament governor carey’s foresight fortitude birthday legacy grows larger passing
553,meet
554,partnerships drive impact that’s
555,confront climate change
556,londoners live illegal levels air pollution incl children today’s launch ulez reduce air pollution cut carbon emissions encourage people switch evs
557,support coal dependent communities integral clean energy transition ec commissioner
558,honored invited address
559,secretary
560,roevwade threatened leave fundamental womens rights increasingly hostile court president trump destroy
561,transatlantic collaboration central tackling biggest challenges time glad join designing future encourage partnerships government business academia uk
562,minister
563,fighting climate change smart market based solutions environment economy putting price pollution practical affordable tools reduce emissions
564,support arts connect artists audiences brighter future hard bring
565,forward
566,study found keeping guns hands pose danger communities safer we’re gun violence epidemic universal background checks law land
567,president withdrew paris agreement cities businesses committed upholding
568,choose tackling climate change growing economy wrong job creation climate action hand hand stories prove
569,utilities play critical role tackling climate change create decarbonization tracker announced bnefsummit leaders fields
570,clean air water basic human current scale coal pollution unacceptable that’s started
571,epa scientists recognized clean water access biggest environmental threat trump admin spent yrs waging assault safe drinking water air protections admin failing miserably protecting environment
572,percentage toxic water pollution coal fired power plants check tomorrow worldwaterday
573,challenged largest cities submit ideas tackle climate change bloomberg american cities climate challenge it’s surprise delivered winning cities ambitious solutions potential reduce carbon emissions million metric tons
574,leadership resolve action senseless violence
575,youth climate strikes sparked movement nation world they’ve shown waiting act climate change unacceptable it’s time hold leaders accountable
576,there’s time waste action
577,leading fight opioid epidemic that’s i’m partnering
578,step fixing infrastructure install smarter thinking planning processes we’ll create national map traces road rail transit air freight routes we’ll leverage data plan fund smarter projects smarter
579,opioid overdose strikes prejudice taking lives americans hour announced plan hit hardest crisis develop bold strategies michigan selected program
580,congrats dean
581,highlighting beyondcoal
582,mexicos gun safety law local action ill support america congrats
583,honor serving president obligation citizen country ill including launch effort called carbon statement
584,it’s hate filled hands gun lives innocent americans leaders house finally taking steps close charleston loophole
585,forward addressing graduates americas top universities
586,poll poll overwhelming support common sense gun reform universal background checks house honored people taking action senate wh power citizens demanding change
587,nevada leader critical issues matter americans gun safety leaders
588,america’s infrastructure system broken money visionary plan smarter faster safer greener infrastructure network brings usa st century here’s
589,people gun safety day people saved stronger gun laws lose lives victories dont happen overnight progress
590,president ted pappageorge
591,air pollution threat environment public health chance action save millions lives amp improve economies process countries spur progress cities solution india
592,president’s rejection science reason danger pentagon intel community climate change poses threat security including climate denier sham panel undermine reports won’t change reality
593,building wall wont solve real challenges fighting climate change senseless gun violence creating jobs health care affordable stopping opioid crisis improving public schools college affordable investing infrastructure
594,trumps decision declare national emergency crisis exist ignoring true national crises total failure presidential leadership dangerous cynical political game
595,congratulations
596,unilaterally declaring national emergency build wall appease trumps political base politics worst diverting money government worst run country
597,remember seventeen students staff shot killed seventeen injured marjory stoneman douglas school parkland florida renew commitment honor victims gun violence action
598,republicans obstruct progress climate action local leaders country continue accelerate glad washington tonight congress community special screening
599,accelerating transition fossil fuels requires swift action leadership
600,immigration american story entire basis countrys success people build lives families story
601,leadership
602,published west east coasts businesses prepare economic costs climate change amp enormous difference local leaders la
603,coal pollution real consequences environment public health wh props coal industry we’ve partners
604,hope david claudias leadership inspire step education accessing outstanding education minds gift ensuring universities impressive cambridge remain cutting edge
605,president sounds alarm wall don’t ignores real challenges climate change gun violence claims lives day inside borders won’t distracted finding solutions sotu
606,american greatness immigrants choosing greatness starts understanding means choosing real solutions broken immigration system gimmicks wall
607,ralph northam governor champion gun safety light racist deeply offensive yearbook photo lead virginia effectively resign step
608,derek jeter classy clutch true champion november mystery elected hall fame mystery left ballot
609,science climate change makes extreme weather frequent intense americans hand wildfires hurricanes polarvortex midwest climate champion wh lead forward
610,manufacturing vital source middle class jobs hampshire country presidents trade war driving factory costs amp harder companies hire grow americas workers deserve president
611,announced ill outline plan green deal accelerating transition clean energy st pillar investing people communities powered economy decades econ benefits green deal reach corner country
612,americans dying overdoses opioid epidemic national crisis
613,likelihood independent split anti trump vote electing president risk refused run afford run
614,presidency entry level job
615,ive ive mayors parties aisle develop innovative policies programs people elected solve
616,i’ve involved gun safety movement i’m glad ive energy movement biggest reason starts word moms
617,spoke virginia democratic business leaders told government shutdown complete failure executive leadership totally incompetent management
618,president sign equality act law provide consistent discrimination protections lgbtq americans variety including housing employment
619,time senate act remove trump office won’t jobs november join
620,poll vast majority americans understand climate change real citizens cities businesses leading washington wont candidate national office plan bold action
621,temporary public art installations aim revive camden nj’s rail road bike routes strengthening local artistic community amp improving quality life residents congrats
622,honor address naval academy leadership conference welcoming serving nation
623,progress realizing dr kings dream pace progress slow
624,secretary
625,i’ve believed arts investment cities attract residents businesses send message cities stand congrats
626,faster accelerate investments reduce emissions create jobs progress fighting climate change
627,canada bound border miles commitment values stretch centuries
628,day americans lose lives due guns hundreds shot injured
629,bloomberg american cities climate challenge supports ideas fighting climate change strong mayors implement congrats winners incl winning cities
630,pledge fixdemocracyfirst protecting voting rights americans preventing gerrymandering easy eligible americans cast ballots ensuring elections safe secure here’s we’ll
631,fixing methane leaks helps fight climate change strengthening economy
632,updated edition bloomberg bloomberg brings story company century it’s story it’s thousands bloomberg employees helped write
633,congratulations
634,conversation mayor
635,addressing climate change urgent challenge opportunity joined
636,climate change real candidate federal office plan reduce impact joining
637,joining
638,week sums failing presidency
639,ice watch london
640,juul’s partnership altria reveals cig companies taking page tobacco industry playbook deeply middle hs students vaping regularly
641,tragically gun deaths hit action common sense gun laws save lives demand change washington
642,congratulations
643,caught
644,today’s alarming report school students cigarettes doubled lead major steps prevent companies marketing products children
645,thousands talented lower income students qualified attend country’s top colleges chance
646,michael douglas movie star hes accomplished screen makes role model dedicated life building world im honored count friendship support unite rebuild america
647,world sign paris climate agreement weve lot progress bvfclimate gathers leaders innovative critical meet exceed goals
648,london
649,taking action washington won’t local governments businesses citizens political spectrum tackling climate change
650,bring transparency capital markets build resilient inclusive economy government private sector talk chances success that’s todays
651,public art reminds it’s boldly cop underway poland hope icewatchlondon public art piece
652,crucial
653,empowering women build brighter equal future night celebrated chapter
654,i’ve lucky
655,france california friend author
656,iowa power wind
657,i’m coming iowa
658,tonight cities premiered
659,cities businesses taking steps tackle climate change amp build bright future country
660,mayor
661,yesterday lost courageous president generation george hw bush i’ll admire courage commitment lifelong service american people
662,combat opioid epidemic bring leaders public health education front lines crisis challenge scale attempted
663,discovery unused disaster aid puerto rico unconscionable past suffering fellow citizens compounded political games mismanagement america unite puerto rico
664,inspiring meet mothers recovering addiction medically assisted treatment
665,opioid addiction national crisis community immune partnership
666,opioids drug overdoses top death americans accept i’m giving million expand fight
667,joining top innovators policymakers morning day bloomberghealthsummit we’ll discuss creative solutions nation’s toughest public health challenges
668,opioid epidemic national health crisis historic proportion federal government tackling urgency requires
669,hospitality mayor
670,congratulations mayor
671,st time wwi life expectancy declined opioids reason bloomberg american health initiative
672,lessons ive learned
673,congratulations paul volcker
674,climatescope report
675,hope initiative bh link innovative programs helping address opioid crisis rhode island staff hard save lives
676,opioid epidemic national emergency devastating consequences progress officials medical professionals law enforcement officers survivors rhode island proving
677,opioid epidemic requires bold urgent action cooperation leaders public health criminal justice community advocacy
678,africa business media innovators forum week bring sharpest minds business government hope accelerating successful growth media industry middle class economies africa
679,businesses backbone economy companies employees join
680,people asset entire organization benefits diverse inclusive culture
681,tulsa proposed sweeping ambitious strategy invest black wealth creation close racial wealth gap plagues country comprehensive inclusive initiative goals greenwoodinitiative
682,programs
683,i’m giving billion
684,cities leading innovative solutions urban challenges can’t measure can’t manage
685,ensure veterans top tier education american talent initiative committing enrolling graduating served
686,people world breathe polluted air bold action meet challenge real difference india
687,left unchecked tobacco kill billion people century proven tobacco control policies helping save lives adult smoking rates lower we’ll fight evidence based interventions ensure trend continues
688,coal fired power plants closing faster americans cleaner cheaper energy environment public health economy
689,anchorage’s public art challenge winning project seed lab partnership
690,women alpha kappa alpha homeless inspiring honored spend afternoon packing backpacks homeless backpack project sisters aka
691,night strength gun violence prevention movement gun sense candidates winning bids congress proving candidates stand common sense gun laws elected dont defeated
692,winning house democrats serve bulwark white house shown respect rule law bringing country america start
693,election day republicans washington failed lead failed solutions failed bring wont stand im voting democratic
694,american patriots lost lives attack pearl harbor ago it’s sacred senator
695,american people favored common sense gun regulations election hard
696,nation immigrants choose honoring welcoming immigrants securing borders
697,birthright citizenship sacred constitutional presidents attempt evidence elect democratic congress vote
698,vote becauseitmatters issues care november election decided turnout people cast ballots jodie foster
699,day called reflect legacy americans dr martin luther king jr racism injustice marched dream marched mlkday
700,minneapolis volunteers
701,acceleration program bloomberg american cities climate challenge cities grow economies protect public health taking action fight climate change congratulations winners named
702,it’s fair
703,estonia leading front digitizing government services
704,washington asleep wheel cities sizes driving america future theyre leading climate change gun violence public health serving engines progress citylab citylabdetroit
705,mayors country tackling issues washington ignoring
706,billion people rely oceans protein overfishing marine ecosystem decline environmental public health issues glad partner friend
707,pittsburgh week
708,sake environment health leaders country confront climate change
709,paramount ensure equal treatment lgbtq americans workplace communities
710,geoffrey canadas changed trajectory harlem kids proved raise expectations schools resources meet glad support raise bar education america
711,forward joining global leaders citylabdetroit week discuss challenges cities facing solutions
712,it’s clearer congress midterm elections weeks we’re taking message coast coast urging voters elect democrats house senate
713,november test political strength succeed people polls text plan plan vote
714,bob steel phenomenal job nyc’s deputy mayor economic development guiding term investments science tech arts exemplifies service leadership deserving recipient
715,effects climate change grow frequent damaging critical dramatically cut pollution protect public health amp environment glad
716,glad canadian pm
717,election day chance washington start aisle glad join conversation citizencnn conference discuss issues facing americans
718,road victory november runs straight pa
719,earlier
720,we’re black entrepreneurs access resources create scale businesses helps black businesses communities entire economy greenwoodinitiative here’s we’re
721,pittsburgh mayor
722,glad meet entrepreneurs
723,congressman
724,weeks left election lot glad support candidates congressman
725,glad announce winning cities bloomberg american cities climate challenge
726,experts advise targets net emissions pm
727,glad mayor
728,conversation
729,challenge black wealth creation inextricably linked racial inequalities past i’m determined breaking link centerpiece presidency homeownership central goal
730,obesity key risk factor ncds curb epidemic save lives proven policies governments critical role step measures worldobesityday
731,mary schapiro female sec chair regulator presidents join
732,congrats
733,congrats
734,road crashes leading death globally news interventions prevent glad speak
735,im registering democrat
736,mayor
737,century pines jewish center pembroke pines hosting tonight road democratic house majority runs straight florida
738,we’re communities families address systemic inequality millions black americans owning home greenwoodinitiative here’s we’re
739,parkland community stood spoken inspired people country november chance real difference
740,congratulations winners
741,catch
742,cities continuing lead congress white house wont tonight im glad announce pledge million support ballot initiative led gov
743,congress failed american people reaching aisle solve acting equal branch government leaders stand
744,congratulations
745,bloomberggbf week heads ceos discuss innovative solutions common joined success measured months
746,career howard marks standout voice world finance steps questions glad hear insights celebrate book mastering market cycle odds
747,hundreds america systematically stole black lives black freedom black labor theft labor transfer wealth enshrined law enforced violence greenwoodinitiative
748,noncommunicable diseases worlds biggest death power change
749,proven policies sugary drink taxes warning labels governments difference combating growing burden obesity glad discuss strategies tackling public health challenges heads
750,prime minister
751,conversation
752,ensure health safety future planet global community continue momentum fight climate change pres
753,nation role play addressing migration endorsed ceos bloomberggbf global compact migration designed guide nations respond real leadership president
754,joining fellow hosts president
755,greenwood initiative triple wealth black families doubling black owned businesses helping million additional black families buy house investing billion strengthening communities
756,climate risks opportunities transparent markets investing climate solutions glad
757,prime minister
758,watch live world’s prominent leaders public private sectors bloomberg global business forum we’ll discuss innovative collaborative solve challenges boost global economic growth bloomberggbf
759,heads ceos gathered bloomberggbf set shape future i’m optimistic accomplish watch event live starting
760,excellency
761,prime minister
762,holiday weekend dedicate words dr king spoke final day earth memphis
763,international trade plays vital role addressing global challenges businesses govts cooperate progress building inaugural bloomberggbf tomorrow heads ceos gather address major issues
764,glad sit friend jack ma
765,bloomberggbf wednesday heads delegation join ceos world discuss common goals foster economic prosperity future generations
766,election cycle i’ll putting record amount money supporting women candidates congress win women
767,argentinas president
768,heads business leaders including
769,london mastaba
770,catch london team earlier
771,students taught history slavery experience enslaved people history greenwood black history american history greenwoodinitiative
772,inspiring moms dads survivors volunteers
773,ago president eisenhower funded world’s national system modern highways keeping modernizing electric autonomous cars essential economic competitiveness global marketplace
774,speed gun safety movement weekend
775,measure manage tomorrow
776,glad join incredible volunteers
777,cities forefront fighting climate change joined leaders
778,global community
779,children education support succeed essential creating economic opportunity greenwoodinitiative
780,governments join powering
781,joining businesses philanthropists civil society china progress taking climate action i’m honored join minister xie’s china global climate initiative chair
782,joined
783,tomorrow
784,statement
785,baltimores bold health commissioner
786,joining
787,im running president difference greenwoodinitiative
788,real action climate change happening washington cities private sector
789,tensions tariffs create economic uncertainty industries countries world bloomberggbf welcomes business government leaders collaborate focus increasing global trade investment
790,forget
791,friend jack ma decided devote time philanthropy education that’s news china world i’m forward
792,hard resilient local residents continued support public private partnerships
793,congratulations
794,putting plain packaging effect uruguay president vázquez demonstrated leadership courage taking action protect citizens opposition tobacco companies
795,arts inspire people provide jobs strengthen communities round arts innovation amp management grants austin orleans city’s cultural organizations reach audiences expand impact
796,honored stand lgbtq community fight equality justice president protect lgbtq community hatred violence discrimination here’s
797,challenge black wealth creation inextricably linked racial inequalities past i’m determined breaking link centerpiece presidency
798,cities businesses leaders continue action climate change matter federal government doesn’t california’s renewable target proof fulfill
799,glad meet alumni
800,business world leaders address rising economies asia middle east africa amp latin america forward hosting inaugural economy forum singapore amp beijing fall
801,colorados plan move
802,senator mccain patriot integrity honor leaders
803,cities create solutions citylab summit innovative thinking collaboration forefront citylab detroit gathering local leaders address urgent urban challenges time
804,london mithraeum bloomberg space
805,statement epas coal pollution rules
806,city individual culture character share common challenges tackling challenges requires building team glad senior teams mayors participating bloomberg harvard city leadership initiative
807,kofi annan partner city hall leadership critical mobilizing global efforts issues including terrorism climate change it’s build legacy
808,live tulsa
809,arts innovation management program local arts organizations cities increase chances success enhance benefits generate week pittsburgh selected join
810,washington dc
811,honorary degree harvard aretha ill guess biggest ovation earned respect generations american treasure miss
812,american people favor common sense gun regulations theyre proving polls gun sense candidate ballot candidates won democratic primary races
813,parents survivors volunteers country helping
814,im announcing greenwood initiative ambitious plan close historic economic gaps society central focus presidency builds commitment past create economic growth communities
815,arts inspire people provide jobs strengthen communities visited
816,american people favored common sense gun safety regulations isn’t elect candidates support involved
817,coal dying result economics advocacy americans cleaner air lower electricity bills administration prop coal industry americans pay bills lost jobs worse health
818,congratulations
819,congratulations
820,glad meet bloomberg startup interns brightest students profit partners
821,epa fight life cities communities care clean air climate change lead charge misguided attempt strip california authority regulate auto emissions
822,congratulations
823,gary mayor
824,i’m historic greenwood district tulsa black wall street i’m unveiling ambitious initiatives forward tune livestream
825,idea bloomberg harvard city leadership initiative grew belief power cities effect change appreciation mayors teams drive change meet class mayors week nyc
826,japan climate initiative businesses cities leading climate action network japanese companies local governments amp nonprofit organizations committed reducing carbon emissions
827,shortlisted
828,finalists selected advance public art challenge submitted proposals aim address pressing issues facing cities sustainability immigration
829,americaspledge opportunity agenda outlines tangible bottom strategies sectors account total carbon dioxide equivalent ghg emissions deliver climate goals
830,released americaspledge opportunity agenda highlights policy drive ambitious climate action cities businesses world achieve goals
831,mayor
832,glad berlin mayor michael müller
833,tonight we’re salt lake city ut it’s trump win it’s save planet americans win supporters defeat trump ut blue
834,alienating allies share values diplomacy counter productive americans parties demand stop
835,ca reaches emissions target ahead schedule it’s don’t washington meet climate goals glad climate leader partner
836,hosted president
837,half sweden’s national energy supply renewables government aims reach net emissions catch
