doc_id,text
1,mayor pledged ensure lgbtq yorkers protected hatred violence discrimination president i’ll extend pledge america proud friend
2,running campaign americans president serve americans road we’re americans join
3,spoke bloomberg supporters oakland ca climate change public transit care planet’s future
4,cities finding innovative citizens involved solving improving services congrats
5,spearheading investment transportation infrastructure advocating level people call city home oakland mayor
6,hes real mccoy
7,tobacco targets children profits expense american lives trump special ahead people fought beaten tobacco president ill continue fight
8,rode bart oakland ca i’m believer public transport ability reduce carbon footprint that’s i’m investing public transportation centerpiece strategy cutting carbon pollution
9,people don’t pollute clean transportation plan reduce pollution traffic fuel costs cut carbon pollution
10,building campaign tough fights win thrilled strong pragmatic leader
11,expert vanity projects heres youve usa tax cut people didnt complete surrender gun lobby total rollback environmental protections broken promise protect pre existing conditions
12,debate dont qualify ive penny contributions loan million dollars
13,business government issues matter women white house committed advancing inclusive agenda women womenformike
14,it’s time washington dc puerto rico representation congress minority senators block let’s votes
15,pulse nightclub shooting
16,president ill create nations wildfire corps federal tribal partnership we’ll prioritize hiring rural amp forest communities fires break we’ll provide communities firefighters
17,todays decision floridas supreme court extends ugly history voter suppression america youve incarcerated served time deserve regain fundamental vote
18,staggering cost health care country leaving millions americans struggling unacceptable recently met meaghan kilner time cancer survivor alexandria virginia honest conversation true cost health care
19,avoid worst impacts climate change rapidly reducing carbon pollution investing clean energy equip communities cope climate impacts i’m announcing plan resilience
20,wildfires western quadrupled frequency burning times land fires displace people homes contribute carbon emissions strategy fires
21,combatting climate change isn’t giving investing cleaner air water cheaper power jobs elect president whos climate denier
22,trump tower trump properties nyc millions fines meeting green building regulations unlike climate denier chief data getitdone
23,success life i’ve strong women celebrate launch womenformike nyc tonight
24,defeat trump november women rose tonight we’re celebrating launch womenformike york watch live
25,fight lgbtq equality justice president protect lgbtq community hatred violence discrimination
26,i’m honored support voters audrey smaltz passion contagious faith humbling i’ll proud womenformike
27,equality rights law denied abridged account sex va approve words shouldve approved time ago progress moving slowly direction
28,measures clean buildings initiative cut pollution pathway decarbonization mid century actionable attainable goals shape save future
29,america loves loves america that’s i’m happy humbled judge judy sheindlin’s support judy womenformike
30,youth cigarette epidemic hands president doesnt buckle pressure tobacco industry ive led charge tobacco companies career ill white house president
31,ive led charge tobacco im stopping president ill direct fda ban flavored cigarettes
32,administration disregard peoples health safety holdup disaster aid puerto rico low
33,clean building initiative includes measures homeowners building owners tenants upgrade homes buildings save energy eliminate pollution we’ll prioritize people low income underserved communities
34,cutting emissions fast means dealing biggest emissions contributors building sector represents greenhouse gas emissions change
35,team
36,candidates spending time iowa hampshire campaign investing maine swing defeating donald trump america that’s i’m proud announce office scarborough
37,campaign hq hard
38,worried
39,coal clean energy future im proud
40,im running president management experience beat donald trump catching
41,foxes guarding henhouse bank robbers running treasury joker running department justice
42,attack vote attack constitution insult generations americans fought continue fight civil rights
43,supreme court ruled trumps plans apply wealth test immigrants applying green cards fallen tired poor huddled masses yearning free
44,democratic field focused nh ia trump operating speed battleground can’t afford advantage that’s i’m taking fight trump
45,democratic primary system handicapping party’s chances winning presidential elections reorder calendar reflect diversity electorate focus win november
46,person nation day
47,creating jobs isnt talk ive spent entire career
48,veterans ryan mcgill lot country military offer communities we’re giving opportunities succeed it’s time fight fought
49,trump economy history country watches stock ticker economy isnt americans create jobs grow incomes investing research talent amp infrastructure
50,love country sit sidelines stake support joining judge judy sheindlin campaign trail texas yesterday
51,dallas wrapping texas tour friends supported country stars texas bright americas future getitdone
52,road flip texas blue getitdone
53,we’re vermont syrup beer we’re vermont shares issues rest america climate change gun violence opioid epidemic defeat donald trump solve
54,spending weekend austin
55,bus cities riding getitdone express san antonio san marcos austin waco dallas flip texas blue
56,pictured saturday goal uniting country nation supporters rallying communities defeat trump getitdone support
57,people nation support campaign couldnt honored grateful hopeful future defeat donald trump rebuild america getitdone
58,pit stop san marcos tx bbq brisket coleslaw beans
59,texas gov abbott announced texas accept refugees tx president trump american policy president trumps attempts demonize scapegoat refugees immigrants
60,america loves loves america im happy humbled judge judy sheindlins support traveling texas bus tour judy
61,howdy texas i’m bus tour lone star meeting thousands texans care country future we’re change nation we’re
62,god trust bring data data drives economy drive priorities government era fake news alternative data save world
63,hurricane maria trump helped puerto rico throwing rolls paper towels playing politics federal aid earthquake displaced thousands he’s puerto rico
64,trump repeatedly declared election rigged
65,vote fundamental protects voter suppression expanding free fair access ballot preventing disenfranchising african americans partisan gerrymandering federal elections
66,trumps economy strong claims wages stagnant jobs clustered build economy americans country
67,trump administrations denial climate change doesnt real president understands urgency imminence climate crisis action
68,trump promised people ohio factories jobs safe promptly forgot factories closed jobs disappeared votes he’s empty promises
69,create jobs train people jobs connect employers education sec
70,scott cooper served country deployments iraq afghanistan hes tired trump administration’s empty promises real action helping veterans transition civilian life scott believes
71,mayor adopt legislation banning smoking bars restaurants cities lead heartening efforts saving lives mistake isnt
72,rolling epa regulations protect planet isnt anyones special president selling future bidder
73,lot candidates they’re create jobs creating jobs talk it’s i’ve spent career
74,ago trump travel ban muslim majority countries kickstarting divisive incendiary presidency muslims communities feel unwelcome trump doesnt understand diversity americas strength
75,can’t continue opportunity jobs clustered it’s prosperity divide trump worse love country sit sidelines amp watch happen here’s strategy
76,im minnesota visiting darin johnsons soybean farm family generations economy agenda focuses spreading jobs pay america communities dont left
77,ago unspeakable evil tucson friend
78,threats abroad neglect health safety fellow citizens home administration build team meets presidents basic responsibility keeping americans secure
79,cost housing food health care education increasing class wages aren’t keeping pace president i’ll raise minimum wage hr increase child tax credit american worker raise family poverty
80,president i’ll invest america’s valuable asset people rust belt bible belt we’ll lead major expansion apprenticeship programs invest community colleges connect americans jobs
81,trump counting economy lift victory he’s hoping career politician who’s created jobs i’ll economy won’t selling american people empty promises
82,national jobs strategy focuses helping people rural underserved communities local jobs disappear cities continue boom
83,starting day chicago’s south i’m rolling strategy bringing opportunity jobs communities country short changed trump administration
84,campaign we’re running people
85,marks liberation auschwitz statement holocaustmemorialday neveragain
86,opioid crisis national emergency lives families destroyed trump lot talk action continue president heres
87,ive supported candidates virginia tomorrow time decades democrats control assembly im proud played progress im hopeful means future va country
88,pleasure spending morning mayor
89,people puerto rico lot receiving support proud resilient emerge stronger mornings earthquake sending love island yorkers borough
90,support amendment gun violence tearing communities stop day wait lives lost stronger background checks guns hands people shouldn’t
91,glad judge judy corner support
92,live country stories normal unacceptable gun violence country true national emergency dedicated lifes combating president continue fight
93,people california integral fight defeat trump that’s we’re creating strongest operation california primary history we’re campaign offices ca
94,grabbed cup coffee friend fellow mayor
95,we’ll bring prescription drug prices countries negotiation we’ll revise law authorize medicare negotiate drug companies set upper limit negotiated price
96,people helped elect trump suffer takes credit thriving economy leaves i’ll american including communities opportunity succeed
97,past presidential campaigns california granted mistake we’re campaign offices golden starting office riverside
98,entrepreneurs veterans met bedrock american economy announced initiatives american entrepreneurs succeed
99,veterans management leadership potential average ceo spoke fuse founder sumner lee amp veterans leveraged military experience build businesses vets transition civilian life
100,spent morning
101,arrived california headlines progress trump’s failure act climate change november time elect president support efforts
102,trump pledged president we’ve veterans add list promises failed administration fix what’s broken solutions bring people who’ve served
103,president trumps proposed rollback environmental protections federal agencies ignore climate change assessing environmental impacts highways pipelines major infrastructure projects plan opposite
104,ive combat civilian life military competent trained people world that’s true glad share military veteran policy plans
105,i’ve stood lgbtq community fight equality justice we’ve progress honored lgbtq champions
106,americans paying prescription drugs brand drugs prices times countries can’t drug companies writing rules heres plan reduce america’s drug prices
107,promise lose sight tremendous sacrifice veterans military families day country repays debt owe
108,unquestionable unacceptable truth women’s healthcare system country doesn’t treat women equally change change here’s start
109,trump continues drag backwards fight climate crisis maintains outright denial climate change australia burning change leadership
110,start decade americans focused resolutions grand plans future i’ve found helpful approach
111,recently met christina lost daughter overdose courage runs sober living house struggling recovering ill forget conversation story common accept
112,campaign isn’t leaving north carolina defeat donald trump
113,support veterans military families transition civilian life government provide resources engage private sector
114,veterans employed that’s moral failure it’s president i’ll vets jobs advantage training teach skills resources start businesses
115,visited fayetteville nc home ft bragg honor speaking military issues transitioning civilian life country repays debt owe
116,north carolina volunteers raleigh office
117,rising cost prescription drugs forced families choose maintaining health debt president trump promised guess happened
118,president day repay debt owe veterans starting helping succeed civilian workforce i’m announcing proposals increase opportunities veterans
119,statement killing qassem soleimani
120,nyt trumps proposals weaken major environmental regulations odds established science trumps appointees
121,womans access abortion isnt privilege fundamental law land ive supported reproductive health mayor philanthropist president appoint judges preserve roe
122,stand
123,democrats defeat donald trump power signed
124,father taught opportunity obligation act country opportunities fortunate
125,american territories overlooked primary process voice role play election im forward
126,womens health country attack african american women time women resources care deserve here’s plan
127,time sew puerto rico’s star national flag president voters ready begin stitching i’ll bring congress country read op ed
128,president ill east office plan i’ll sit team i’ll oval office official functions tweeting rest time i’ll leader team
129,president i’ll instate initiatives designed decrease disparities maternal health outcomes country reduce disproportionately maternal mortality rate women color
130,chance talk local doctors experts womens childrens health underserved communities al country african american women access quality affordable healthcare president i‘ll change
131,couldnt
132,earlier mayor
133,mayor
134,women’s health attack trump administration leading charge restricting women’s access reproductive sexual health services amp worsening disparities care white amp african american women heres ill
135,start americans care stopping gun violence fighting climate change improving schools creating jobs pay living wage that’s i’ll president
136,beat cancer rep john lewis team pulling
137,trump spends days dividing people insulting people complaining i’ve spent life bringing people motivating amp that’s real leadership amp that’s bring washington
138,bigger texas texas biggest battleground democrats win i’m fight hell speak texans issues matter
139,engineer im appalled citizen im outraged president ensure policies actions driven research science
140,afternoon spent door door dr
141,church houston morning church shooting fort worth couldve happened sanctuaries safe action stop
142,i’m honored chance address
143,american yorker jew shocked saddened night’s attack horrified rise anti semitism country america founded people religions worship safely amp free persecution
144,we’re building unrivaled team texas blue ballot including headquarter houston field offices rest march primary
145,trump easier corporations poison water stand
146,america pays health care country costs leaving millions americans money meet unacceptable here’s plan
147,donald trump campaigning key swing democratic campaign focused taking trump key swing country win november afford wait
148,puerto ricos poverty rate impose federally controlled debt restructuring process stunts ability care people can’t continue create government financial system helps pr hindering
149,day average americans die opioid overdose someones son daughter brother sister loved epidemic national emergency respond here’s plan
150,love country sit hope national worse i’ve supported led issues democrats care left city hall
151,feliz navidad felices fiestas
152,hard staff families incredible kids
153,merry christmas feliz navidad language peace goodwill
154,earlier news outlet accurately reported subcontractor vendors prison workers phone calls behalf campaign learning immediately relationship company statement
155,trump start
156,president trump concerned bald eagle wouldnt gutted endangered species act saved
157,light candle menorah tonight hanukkah calls offer gratitude celebrate hope day chag sameach
158,puerto ricans deserve we’ve country treated class citizens here’s invest term success pr provide stability equity deserve
159,democratic party wisely chose milwaukee host democratic national convention realizing election haul wisconsin field office tonight
160,detroit city hit hard times country walking streets meeting people hope progress future
161,defeat trump bringing fight straight campaign offices battleground pennsylvania hardworking team philadelphia office running holidays
162,tasting holiday treats campaign trail philly institution
163,run president learn day
164,time world war life expectancy declined consecutive opioids reason can’t sit alarming trend continue here’s plan we’ll tackle opioid crisis
165,day americans die opioid overdose toll crisis devastating unacceptable plan provide people medication assisted treatment removing obstacles prevent care
166,it’s time treat opioid epidemic national emergency i’m chillicothe ohio hear hand community leaders fight opioid crisis
167,holidays trump asthma disease electricity bills scrooge reduce coal
168,mayor
169,america ready i’m bring people happen common ground build country proud florida team feel miami
170,administration lobbyists won’t past lobby i’m don’t penny
171,ive lucky chance
172,americans deserve affordable healthcare requires wishful thinking medicare proposal elect donald trump expand coverage
173,health care plan create public health insurance option build progress affordable care act lower premiums drug costs easier enroll public private insurance cap network charges medicare rates
174,i’m tennessee people lack health coverage can’t accept plans health care affordable accessible americans
175,million people don’t health insurance it’s expensive health care shouldn’t families debt president i’ll lower health care costs health insurance reach americans
176,election referendum save constitution trump light fire
177,million americans health insurance expensive build health care system enjoyed meeting health care experts community hometown medford ma hear experiences insights
178,job leader unite offices divide sit desk brought tradition openness city hall mayor i’m elected president i’ll run white house i’ve run
179,child tax credit broken recently announced plans fix poorest families refundable phasing faster starting dollar earnings
180,israels unitedformike
181,colorado privilege meeting jane dougherty sister tragically killed sandy hook shooting story american experience
182,support
183,students shot day trump’s unwillingness act protecting nra children hes choice beat
184,newtown heroes field leadership win fight gun violence congratulations team nighthawks
185,failure presidential leadership americas pledge weve brought cities businesses dedicated meeting paris agreement goals white house leads climate change mine
186,home heart
187,ago people believed fast lot credit shannon it’s moms students volunteers gun sense movement stronger effective
188,charlotte field office i’m thankful team they’ve feel home hard we’ll flip north carolina blue november
189,president ill ensure federal government partner city officials mayor vi lyles mayor
190,flight north carolina legacy history keeping tradition nc lead field office charlotte follow
191,watching news california heavy hearts thinking bryants families devastated terrible tragedy
192,rev dr clifford jones
193,renew commitment honoring victims sandy hook americans experienced devastation gun violence fighting save fate
194,weve lot progress fighting climate change trump administration imagine president leads
195,we’ll cut greenhouse emissions entire economy candidates talk they’re office i’m focused delivering progress immediately i’m doer talker
196,we’ll replace existing gas plants stop construction critical stopping worst effects climate change gas bigger source climate pollution coal emissions gas growing
197,coal campaign we’ve closed half coal plants country president trump we’ve set goal retiring replacing coal clean energy sources
198,jeremy corbyns catastrophic uk warning democratic nominee defeat donald trump running campaign appeals americans divides
199,president i’ll set ambitious climate goals country goals achieve push reduction electricity emissions setting path clean electricity
200,ballad climate denier
201,beat trump rebuild country talented organizers connecting voters battleground
202,president sets tone country it’s exclusive inclusive divisive uniting appeals fine people bigotry unequivocally rejects choose inclusion choose tolerance choose america unitedformike
203,catch willie brown san francisco night
204,mayor
205,despicable attack jersey city deeply disturbing pattern violence jewish community hard true america common
206,trump rules toxic chemicals air water falsely claims credit keeping clean bankrupt times calling successful businessman
207,endorsement mayor
208,president i’ll raise minimum wage hour raised york nationally
209,affordable housing crisis we’re releasing proposals
210,americans struggling they’ve washington i’m sharing proposals fight poverty supporting trailblazing local leaders mayor
211,helped democrats win house hold president accountable im glad defend republican party excuses presidents flagrant dangerous abuses power
212,president protect lgbtq community close disparities health care access quality stop violence transgender people advocate equal rights settle won’t
213,defender israel that’s faa banned american carriers flying israel gaza conflict boarded el al flight nyc tel aviv express solidarity israelis
214,president trump harmed america damaged reputation abroad can’t afford reckless unethical behavior candidate win november can’t afford fail
215,prime minister
216,americaspledge report ambitious federal climate policy accomplish decade ahead outlines scenarios significantly reduce emissions meet goals paris agreement
217,trump pulled paris agreement teamed
218,madam secretary
219,rt hon claire perry oneill leadership climate issues forward supporting president cop helping success cop
220,congratulations named
221,americaspledge uniting cities business fight climate change report climate action accelerate progress we’re amp fulfill commitment paris agreement
222,congratulations appointment
223,perpetrators anti semitism hate presidential megaphone trump’s refusal condemn violent extremist president call domestic terrorists fbi doj crack
224,global cities climate progress local level
225,mayors continuing impact climate change americaspledge report proves i’m glad share we’re recommitting city driven climate action
226,beating climate change wont require miracle leadership common sense action investing clean energy reduce emissions create jobs
227,congratulations appointment executive vice president
228,glad meet spanish finance minister
229,i’m cop deliver report america’s pledge founded trump announced withdraw paris agreement acts president enter agreement increase america’s commitment reducing emissions
230,mayor
231,deeply disturbing attorney concerned protecting president protecting country russia
232,leadership isn’t shaking fist world putting ideas website tweeting it’s bringing people solve results that’s president taking term climate action
233,im cop madrid president trump wont
234,parents taught judaism shul it’s living values repair world tradition tikkun olam that’s spirit campaign it’s i’m excited launch coalition unitedformike
235,trump paris agreement climate progress happening bold action cities businesses tomorrow i’ll represent cop deliver america’s pledge report we’ve
236,honored address texas democratic leaders weve shot texas blue
237,ive gun violence decade president fight gun violence angle power save lives
238,criminal justice reform issue augusta mayor
239,mayor
240,president track record taking nra winning ive proved gun safety laws passed fight
241,rate teen cig continues grow increasing range tobacco products kids alarming trump protect kids national leadership won’t happen watch
242,president power stop epidemic gun violence we’ll start overhauling background check system effective requiring background checks gun sales
243,i’ve gun violence life’s president i’ll tackle crisis true national emergency i’ll harder criminals guns communities safer gun violence epidemic
244,rep
245,country join fight join
246,officially filed ballot colorado democratic primary
247,colorado win democrats im focus campaign im meet voters chairwoman
248,mayor
249,president we’ll launch national initiative cut imprisonment people half term eliminate juvenile incarceration violent offenders
250,guaranteeing americans equal rights law million people bars developed country disgraceful president fix
